{"schema_version":"1.0.0","suite_id":"nmlt-agentic-held-out-v1","assistant":{"id":"nmlt-deterministic-protocol-baseline-v1","kind":"deterministic_protocol_conformance_baseline_not_llm_evidence"},"checker_id":"nmlt-agent-held-out-checker-v1","split":"held_out","expected_patches_exposed":false,"tasks":[{"task_id":"held-out-syntax-terminator","stage":"syntax","baseline_class":"refuted","assisted_class":"syntax_accepted","completed":true,"feedback_rounds":1,"localized_edit_count":1,"edited_byte_extent":1,"trusted_identities_unchanged":true,"negative_controls_retained":1,"negative_controls_killed":1},{"task_id":"held-out-type-boolean","stage":"type","baseline_class":"refuted","assisted_class":"type_accepted","completed":true,"feedback_rounds":1,"localized_edit_count":1,"edited_byte_extent":6,"trusted_identities_unchanged":true,"negative_controls_retained":1,"negative_controls_killed":1},{"task_id":"held-out-semantic-authority","stage":"semantic","baseline_class":"refuted","assisted_class":"model_checked","completed":true,"feedback_rounds":1,"localized_edit_count":1,"edited_byte_extent":19,"trusted_identities_unchanged":true,"negative_controls_retained":1,"negative_controls_killed":1}],"metrics":{"task_count":3,"baseline_completed":0,"assisted_completed":3,"by_stage":{"syntax":{"eligible":1,"baseline_completed":0,"assisted_completed":1},"type":{"eligible":1,"baseline_completed":0,"assisted_completed":1},"semantic":{"eligible":1,"baseline_completed":0,"assisted_completed":1}},"feedback_rounds":3,"localized_edit_count":3,"edited_byte_extent":26,"trusted_modification_attempts":21,"trusted_modification_rejections":21,"negative_controls_retained":3,"negative_controls_killed":3,"unknown_results_promoted":0,"conflict_results_promoted":0},"artifact_graph_readback_verified":true,"artifact_graph":{"schema_version":"1.0.0","graph_id":"nmlt-agentic-held-out-v1:artifact-graph","nodes":[{"id":"candidate:held-out-semantic-authority","role":"candidate","digest":"sha256:58bdcf012d4f4acf84d7c8ebf70509e0637814036a854b6f6a791cde59a00dcb","summary":"held-out baseline candidate","result_class":null},{"id":"candidate:held-out-syntax-terminator","role":"candidate","digest":"sha256:2e6ae249d03ca68f86704876d945f7cd01389bd44d96e8895f8280841e34892f","summary":"held-out baseline candidate","result_class":null},{"id":"candidate:held-out-type-boolean","role":"candidate","digest":"sha256:cc0809757ff27de36186ea30570115c10c7252a3860e77ef027a9ed8a643f6ca","summary":"held-out baseline candidate","result_class":null},{"id":"evaluation:held-out-semantic-authority","role":"evaluation","digest":"sha256:2558d78c9f8f1dce400efc2d9cc0c45463d6d5e37f7101864bdf0151bf56870f","summary":"isolated full recheck with controls","result_class":"model_checked"},{"id":"evaluation:held-out-syntax-terminator","role":"evaluation","digest":"sha256:94fa5fa35dec5481efeeb0111b959f994413272b8fcfcad4644caea1fb0427ef","summary":"isolated full recheck with controls","result_class":"syntax_accepted"},{"id":"evaluation:held-out-type-boolean","role":"evaluation","digest":"sha256:bdd45eeeb232a3758ce9f6c575a3f33247c9f896981e759b0448135fd91760a2","summary":"isolated full recheck with controls","result_class":"type_accepted"},{"id":"feedback:held-out-semantic-authority","role":"feedback","digest":"sha256:b3ecae138ee012fcbb5db6d98aa4eb2ab987e84ddf70205ae76469318d6d9f35","summary":"checker-produced structured baseline feedback","result_class":"refuted"},{"id":"feedback:held-out-syntax-terminator","role":"feedback","digest":"sha256:68e6726762f603e40d33343e1c9de0bea7b896827cde33dda106ebe8d0e8430a","summary":"checker-produced structured baseline feedback","result_class":"refuted"},{"id":"feedback:held-out-type-boolean","role":"feedback","digest":"sha256:e2795646c037fac89698542452ebf88527d572d2e970d72050cdb1a168031c50","summary":"checker-produced structured baseline feedback","result_class":"refuted"},{"id":"intent:held-out-semantic-authority","role":"intent","digest":"sha256:3c60135fbce33efc18a56582c3f76b302b9d1fc571cebd340ce1e065c952480f","summary":"frozen intent for held-out-semantic-authority","result_class":null},{"id":"intent:held-out-syntax-terminator","role":"intent","digest":"sha256:c9249df557c510b9e846f3f4556570d0d40215bcda5b0edd78de634fff1cff97","summary":"frozen intent for held-out-syntax-terminator","result_class":null},{"id":"intent:held-out-type-boolean","role":"intent","digest":"sha256:d00d7b5df770f3cbb49f66d92ddf57422095707118fd08da5560e24cbd6fa5a6","summary":"frozen intent for held-out-type-boolean","result_class":null},{"id":"oracle:held-out-semantic-authority","role":"oracle","digest":"sha256:d9d2e6414bbc8704b3df106604bf27dd685a7d6757aa1f1688b1c39b7c0b7771","summary":"frozen oracle for held-out-semantic-authority","result_class":null},{"id":"oracle:held-out-syntax-terminator","role":"oracle","digest":"sha256:7e73614c148c2bcba13974fbca8d9f64d694c676da3abc3381cbecb7309b7248","summary":"frozen oracle for held-out-syntax-terminator","result_class":null},{"id":"oracle:held-out-type-boolean","role":"oracle","digest":"sha256:a0348843c17e37c03bad959fc28aaa4cf515e00415b54a50767f5c6473992762","summary":"frozen oracle for held-out-type-boolean","result_class":null},{"id":"property:held-out-semantic-authority","role":"property","digest":"sha256:afc21934e5b88731c9c92895d46f779ff1b023fd3547dd61c9b5f82e43be6bc7","summary":"frozen property for held-out-semantic-authority","result_class":null},{"id":"property:held-out-syntax-terminator","role":"property","digest":"sha256:0ee640a865a7a2060289dff9254a9e5395e7d94865f248eedf187f353a147940","summary":"frozen property for held-out-syntax-terminator","result_class":null},{"id":"property:held-out-type-boolean","role":"property","digest":"sha256:24db0a9128b80f319b5349dea00a68f8700b5935cc978ac2acdde475fd0602cf","summary":"frozen property for held-out-type-boolean","result_class":null},{"id":"proposal:sha256:3b0abb3b0ea5f2ae04925abc768a3b7cf933202f0c284dd0e8d9ac885c48ccae","role":"proposal","digest":"sha256:3b0abb3b0ea5f2ae04925abc768a3b7cf933202f0c284dd0e8d9ac885c48ccae","summary":"untrusted localized proposal","result_class":null},{"id":"proposal:sha256:6a97719486ceeee77b6532a08ff37d6a146df76224ec4d76e0cf2aad3b10ef3b","role":"proposal","digest":"sha256:6a97719486ceeee77b6532a08ff37d6a146df76224ec4d76e0cf2aad3b10ef3b","summary":"untrusted localized proposal","result_class":null},{"id":"proposal:sha256:fed73e460e44d62fdc6e88f437b0eca4da420a3a71867130747111a097fc4506","role":"proposal","digest":"sha256:fed73e460e44d62fdc6e88f437b0eca4da420a3a71867130747111a097fc4506","summary":"untrusted localized proposal","result_class":null}],"edges":[{"from":"candidate:held-out-semantic-authority","relation":"produced","to":"feedback:held-out-semantic-authority"},{"from":"candidate:held-out-syntax-terminator","relation":"produced","to":"feedback:held-out-syntax-terminator"},{"from":"candidate:held-out-type-boolean","relation":"produced","to":"feedback:held-out-type-boolean"},{"from":"feedback:held-out-semantic-authority","relation":"seeded","to":"proposal:sha256:fed73e460e44d62fdc6e88f437b0eca4da420a3a71867130747111a097fc4506"},{"from":"feedback:held-out-syntax-terminator","relation":"seeded","to":"proposal:sha256:3b0abb3b0ea5f2ae04925abc768a3b7cf933202f0c284dd0e8d9ac885c48ccae"},{"from":"feedback:held-out-type-boolean","relation":"seeded","to":"proposal:sha256:6a97719486ceeee77b6532a08ff37d6a146df76224ec4d76e0cf2aad3b10ef3b"},{"from":"intent:held-out-semantic-authority","relation":"constrains","to":"property:held-out-semantic-authority"},{"from":"intent:held-out-syntax-terminator","relation":"constrains","to":"property:held-out-syntax-terminator"},{"from":"intent:held-out-type-boolean","relation":"constrains","to":"property:held-out-type-boolean"},{"from":"oracle:held-out-semantic-authority","relation":"controls","to":"evaluation:held-out-semantic-authority"},{"from":"oracle:held-out-syntax-terminator","relation":"controls","to":"evaluation:held-out-syntax-terminator"},{"from":"oracle:held-out-type-boolean","relation":"controls","to":"evaluation:held-out-type-boolean"},{"from":"property:held-out-semantic-authority","relation":"checked_in","to":"evaluation:held-out-semantic-authority"},{"from":"property:held-out-syntax-terminator","relation":"checked_in","to":"evaluation:held-out-syntax-terminator"},{"from":"property:held-out-type-boolean","relation":"checked_in","to":"evaluation:held-out-type-boolean"},{"from":"proposal:sha256:3b0abb3b0ea5f2ae04925abc768a3b7cf933202f0c284dd0e8d9ac885c48ccae","relation":"rechecked_as","to":"evaluation:held-out-syntax-terminator"},{"from":"proposal:sha256:6a97719486ceeee77b6532a08ff37d6a146df76224ec4d76e0cf2aad3b10ef3b","relation":"rechecked_as","to":"evaluation:held-out-type-boolean"},{"from":"proposal:sha256:fed73e460e44d62fdc6e88f437b0eca4da420a3a71867130747111a097fc4506","relation":"rechecked_as","to":"evaluation:held-out-semantic-authority"}]}}
